{
  "schema_version": "1.0.0",
  "generated_at": "2026-05-28T02:05:27Z",
  "scan": {
    "repos": [
      {
        "path": "/home/user/coo-memory",
        "remote": "coo-labs/coo-memory",
        "head_sha": "c4e1ea365d24fffcf897405b12b9403f83e5698d"
      },
      {
        "path": "/home/user/coo-harness",
        "remote": "coo-labs/coo-harness",
        "head_sha": "25aeb5258b8a1a9855f0fd4c992f6df4feff4146"
      },
      {
        "path": "/home/user/vade-canvas",
        "remote": "coo-labs/vade-canvas",
        "head_sha": "baba412f8732a169a48259d37e7b414a58434d99"
      },
      {
        "path": "/home/user/skills",
        "remote": "coo-labs/skills",
        "head_sha": "457d885fe437779986a3bab48d9e2eeccaff0d05"
      }
    ],
    "transcripts": {
      "dir": "/root/.claude/projects",
      "files_scanned": 4
    }
  },
  "entries": [
    {
      "kind": "skill",
      "name": "agentmail",
      "repo": "coo-labs/coo-harness",
      "repo_dir": ".claude/skills/agentmail",
      "entry_path": ".claude/skills/agentmail/SKILL.md",
      "frontmatter": {
        "name": "agentmail",
        "description": "Give AI agents their own email inboxes using the AgentMail API. Use when building email agents, sending/receiving emails programmatically, managing inboxes, handling attachments, organizing with labels, creating drafts for human approval, or setting up real-time notifications via webhooks/websockets. Supports multi-tenant isolation with pods.",
        "argument_hint": null,
        "allowed_tools": null,
        "tools": null,
        "model": null,
        "license": null,
        "compatibility": null,
        "metadata": null
      },
      "description_chars": 344,
      "body_chars": 6898,
      "total_bytes": 7281,
      "total_lines": 282,
      "vendoring": "custom",
      "vendoring_source": "heuristic",
      "vendor_source": null,
      "type": "api-service",
      "type_source": "heuristic",
      "type_signals": [
        "named external-service skill"
      ],
      "is_reference": false,
      "bundle": {
        "references": {
          "count": 2,
          "files": [
            "webhooks.md",
            "websockets.md"
          ]
        }
      },
      "git": {
        "first_commit_iso": "2026-05-16T01:38:46+02:00",
        "last_commit_iso": "2026-05-16T01:38:46+02:00",
        "commits_count": 1
      },
      "usage": {
        "invocations": 0,
        "unique_sessions": 0,
        "last_iso": null
      }
    },
    {
      "kind": "skill",
      "name": "skill-creator",
      "repo": "coo-labs/coo-harness",
      "repo_dir": ".claude/skills/skill-creator",
      "entry_path": ".claude/skills/skill-creator/SKILL.md",
      "frontmatter": {
        "name": "skill-creator",
        "description": "Create new skills, modify and improve existing skills, and measure skill performance. Use when users want to create a skill from scratch, edit, or optimize an existing skill, run evals to test a skill, benchmark skill performance with variance analysis, or optimize a skill's description for better triggering accuracy.",
        "argument_hint": null,
        "allowed_tools": null,
        "tools": null,
        "model": null,
        "license": null,
        "compatibility": null,
        "metadata": null
      },
      "description_chars": 319,
      "body_chars": 32625,
      "total_bytes": 33168,
      "total_lines": 485,
      "vendoring": "vendored",
      "vendoring_source": "heuristic",
      "vendor_source": {
        "vendor_file": ".claude/skills/skill-creator/VENDORED.md"
      },
      "type": "meta",
      "type_source": "heuristic",
      "type_signals": [
        "meta-skill name"
      ],
      "is_reference": false,
      "bundle": {
        "license": "LICENSE.txt",
        "vendor_file": "VENDORED.md",
        "agents": {
          "count": 3,
          "files": [
            "analyzer.md",
            "comparator.md",
            "grader.md"
          ]
        },
        "assets": {
          "count": 1,
          "files": [
            "eval_review.html"
          ]
        },
        "eval-viewer": {
          "count": 2,
          "files": [
            "generate_review.py",
            "viewer.html"
          ]
        },
        "references": {
          "count": 1,
          "files": [
            "schemas.md"
          ]
        },
        "scripts": {
          "count": 9,
          "files": [
            "__init__.py",
            "aggregate_benchmark.py",
            "generate_report.py",
            "improve_description.py",
            "package_skill.py",
            "quick_validate.py",
            "run_eval.py",
            "run_loop.py",
            "utils.py"
          ]
        }
      },
      "git": {
        "first_commit_iso": "2026-05-16T01:38:46+02:00",
        "last_commit_iso": "2026-05-16T01:38:46+02:00",
        "commits_count": 1
      },
      "usage": {
        "invocations": 0,
        "unique_sessions": 0,
        "last_iso": null
      }
    },
    {
      "kind": "skill",
      "name": "tagging-taxonomy",
      "repo": "coo-labs/coo-harness",
      "repo_dir": ".claude/skills/tagging-taxonomy",
      "entry_path": ".claude/skills/tagging-taxonomy/SKILL.md",
      "frontmatter": {
        "name": "tagging-taxonomy",
        "description": "Apply or look up VADE issue metadata. Use when filing, triaging, or searching issues across coo-labs repos by dimension (issue type, area, Readiness field, Priority field, needs/blocked). Native types + Issue fields are the primary metadata layer; operational reference: `coo/operations/issue-fields-and-types.md` (field list, pinning matrix, API surface). `area:*` and qualifier labels are what remains label-encoded.",
        "argument_hint": null,
        "allowed_tools": null,
        "tools": null,
        "model": null,
        "license": null,
        "compatibility": null,
        "metadata": null
      },
      "description_chars": 418,
      "body_chars": 11659,
      "total_bytes": 12188,
      "total_lines": 283,
      "vendoring": "custom",
      "vendoring_source": "heuristic",
      "vendor_source": null,
      "type": "procedural",
      "type_source": "heuristic",
      "type_signals": [
        "procedural-style name (memo/post/tag/request/status/end-session/tagging)"
      ],
      "is_reference": false,
      "bundle": {},
      "git": {
        "first_commit_iso": "2026-05-16T01:38:46+02:00",
        "last_commit_iso": "2026-05-25T17:12:03+02:00",
        "commits_count": 6
      },
      "usage": {
        "invocations": 0,
        "unique_sessions": 0,
        "last_iso": null
      }
    },
    {
      "kind": "skill",
      "name": "trace-timeline",
      "repo": "coo-labs/coo-harness",
      "repo_dir": ".claude/skills/trace-timeline",
      "entry_path": ".claude/skills/trace-timeline/SKILL.md",
      "frontmatter": {
        "name": "trace-timeline",
        "description": "Render an interactive HTML timeline from a bootstrap-trace run. Use when the user wants to view, visualize, inspect, or \"see\" what happened during a traced boot \u2014 process spans, write/read interleavings, snapshot states, the D-group invariant decisions. Triggers on phrases like \"show me the trace\", \"visualize the boot\", \"timeline of the trace\", \"interactive diagram of the trace\", \"render the trace\", or when investigating a `~/.vade/traces/<run-id>/` directory and a chart would be clearer than text. Reads `xtrace.log` + `snapshots/*/content/settings.json` + `meta.json`, writes a self-contained HTML file that opens in any browser. Read-only over the trace data. Don't invoke for: running a fresh trace (that's the `bootstrap-trace-init.sh` harness via container UI), proposing fixes to the boot pipeline (the audit pause forbids it), or operating on traces from other tools.",
        "argument_hint": null,
        "allowed_tools": "Bash, Read, SendUserFile",
        "tools": null,
        "model": null,
        "license": null,
        "compatibility": null,
        "metadata": null
      },
      "description_chars": 880,
      "body_chars": 8087,
      "total_bytes": 9114,
      "total_lines": 172,
      "vendoring": "custom",
      "vendoring_source": "heuristic",
      "vendor_source": null,
      "type": "procedural",
      "type_source": "heuristic",
      "type_signals": [
        "procedural verb at start of description"
      ],
      "is_reference": false,
      "bundle": {},
      "git": {
        "first_commit_iso": "2026-05-20T19:59:34+02:00",
        "last_commit_iso": "2026-05-25T12:28:00+02:00",
        "commits_count": 3
      },
      "usage": {
        "invocations": 0,
        "unique_sessions": 0,
        "last_iso": null
      }
    },
    {
      "kind": "agent",
      "name": "dispatching-parallel-agents",
      "repo": "coo-labs/coo-memory",
      "repo_dir": ".claude/agents",
      "entry_path": ".claude/agents/dispatching-parallel-agents.md",
      "frontmatter": {
        "name": "dispatching-parallel-agents",
        "description": "Use when facing 2+ independent tasks that can be worked on without shared state or sequential dependencies. Cherry-picked from obra/superpowers; adapted for any Claude Code environment.",
        "argument_hint": null,
        "allowed_tools": null,
        "tools": null,
        "model": "sonnet",
        "license": null,
        "compatibility": null,
        "metadata": null
      },
      "description_chars": 185,
      "body_chars": 5024,
      "total_bytes": 5318,
      "total_lines": 140,
      "vendoring": "custom",
      "vendoring_source": "heuristic",
      "vendor_source": null,
      "type": "agent-orchestrator",
      "type_source": "heuristic",
      "type_signals": [
        "orchestrator-style name"
      ],
      "is_reference": false,
      "bundle": {},
      "git": {
        "first_commit_iso": "2026-05-25T04:56:29+02:00",
        "last_commit_iso": "2026-05-25T04:56:29+02:00",
        "commits_count": 1